title,image,published,description,category,author,image_relation,fake_news_label
Solving the brain's motion-source separation problem: Individual neurons distinguish internal from external motion,https://scx2.b-cdn.net/gfx/news/hires/2024/neuron.jpg,2025-02-19 16:00:33+00:00,"This article has been reviewed according to Science X's editorial process and policies . Editors have highlighted the following attributes while ensuring the content's credibility:

Credit: Pixabay/CC...","medical, science",Sainsbury Wellcome Centre,Yes,Real
"Stomach cancers make electrical connections with the nervous system to fuel spread, study finds",https://scx2.b-cdn.net/gfx/news/hires/2022/nerve.jpg,2025-02-19 16:00:30+00:00,"This article has been reviewed according to Science X's editorial process and policies . Editors have highlighted the following attributes while ensuring the content's credibility:

Credit: Pixabay/CC...","medical, science",Columbia University Irving Medical Center,Unknown,Unknown
New process gets common rocks to trap carbon rapidly and cheaply,https://scx2.b-cdn.net/gfx/news/hires/2025/new-process-gets-commo-2.jpg,2025-02-19 16:00:27+00:00,"This article has been reviewed according to Science X's editorial process and policies . Editors have highlighted the following attributes while ensuring the content's credibility:

Olivine aérolie we...",science,Stanford University,Unknown,Unknown
How Is The Market Feeling About Gilead Sciences?,https://cdn.benzinga.com/files/images/story/2023/movers_image_18.jpeg?width=1200&height=800&fit=crop,2025-02-19 16:00:25+00:00,"Gilead Sciences's GILD short percent of float has fallen 8.91% since its last report. The company recently reported that it has 22.93 million shares sold short, which is 1.84% of all regular shares th...",finance,Benzinga Insights,Unknown,Unknown
Study suggests US facing critical hospital bed shortage by 2032,https://scx2.b-cdn.net/gfx/news/hires/2021/hospital-bed-1.jpg,2025-02-19 16:00:24+00:00,"This article has been reviewed according to Science X's editorial process and policies . Editors have highlighted the following attributes while ensuring the content's credibility:

Credit: Pixabay/CC...","medical, science",University Of California,Unknown,Unknown
Optimist' and 'pessimist' neurons: How the brain balances risk and reward in making decisions,https://scx2.b-cdn.net/gfx/news/hires/2023/decision.jpg,2025-02-19 16:00:22+00:00,"This article has been reviewed according to Science X's editorial process and policies . Editors have highlighted the following attributes while ensuring the content's credibility:

Credit: Pixabay/CC...","medical, science",Harvard Medical School,Unknown,Unknown
"California clinicians boost buprenorphine prescriptions, aiding recovery efforts",https://scx2.b-cdn.net/gfx/news/hires/2023/emergency-dept.jpg,2025-02-19 16:00:15+00:00,"This article has been reviewed according to Science X's editorial process and policies . Editors have highlighted the following attributes while ensuring the content's credibility:

Credit: Pixabay fr...","medical, science",University Of California,Unknown,Unknown
Advances in AI can help prepare the world for the next pandemic,https://scx2.b-cdn.net/gfx/news/hires/2020/pandemic.jpg,2025-02-19 16:00:06+00:00,"This article has been reviewed according to Science X's editorial process and policies . Editors have highlighted the following attributes while ensuring the content's credibility:

Credit: CC0 Public...","medical, science",University Of Oxford,Unknown,Unknown
"Artificial sweetener triggers insulin spike, leading to blood vessel inflammation in mice",https://scx2.b-cdn.net/gfx/news/hires/2025/artificial-sweetener-t.jpg,2025-02-19 16:00:02+00:00,"This article has been reviewed according to Science X's editorial process and policies . Editors have highlighted the following attributes while ensuring the content's credibility:

Aspartame-fed mice...","medical, science",Cell Press,Yes,Real
Experts present method for standardizing goals of care notes in electronic health records,https://scx2.b-cdn.net/gfx/news/hires/2025/senior-care.jpg,2025-02-19 15:52:06+00:00,"This article has been reviewed according to Science X's editorial process and policies . Editors have highlighted the following attributes while ensuring the content's credibility:

Credit: Unsplash/C...","medical, science",Regenstrief Institute,Yes,Real
Psychology research finds brain can quickly 'adopt' new voices,https://scx2.b-cdn.net/gfx/news/hires/2025/psychology-research-fi.jpg,2025-02-19 15:51:05+00:00,"This article has been reviewed according to Science X's editorial process and policies . Editors have highlighted the following attributes while ensuring the content's credibility:

Credit: University...","medical, science",University Of Abertay Dundee,Yes,Real
More work needed on children's supervised toothbrushing programs,https://scx2.b-cdn.net/gfx/news/hires/2025/child-toothbrush.jpg,2025-02-19 15:50:09+00:00,"This article has been reviewed according to Science X's editorial process and policies . Editors have highlighted the following attributes while ensuring the content's credibility:

Credit: RDNE Stock...","medical, science",University Of Sheffield,Yes,Real
Study finds shared cognitive loop between meditation and speaking in tongues,https://scx2.b-cdn.net/gfx/news/hires/2025/man-meditate.jpg,2025-02-19 15:50:03+00:00,"This article has been reviewed according to Science X's editorial process and policies . Editors have highlighted the following attributes while ensuring the content's credibility:

Credit: Ivan Samko...","medical, science",Mcgill University,Unknown,Unknown
Enriching the Hawaiian language with new terms for eldercare,https://scx2.b-cdn.net/gfx/news/hires/2025/old-hands.jpg,2025-02-19 15:49:04+00:00,"This article has been reviewed according to Science X's editorial process and policies . Editors have highlighted the following attributes while ensuring the content's credibility:

Credit: Unsplash/C...","medical, science",University Of Hawaii At Manoa,Yes,Real
"Cardboard panels offer lightweight, sustainable solution for temporary housing",https://scx2.b-cdn.net/gfx/news/2025/cardboard-panels-offer.jpg,2025-02-19 15:48:04+00:00,"This article has been reviewed according to Science X's editorial process and policies . Editors have highlighted the following attributes while ensuring the content's credibility:

Associate Professo...",science,University Of Queensland,Unknown,Unknown
Improving wireless charging: New tech can enhance efficiency via dynamic frequency adaptation,https://scx2.b-cdn.net/gfx/news/hires/2025/wireless-charger.jpg,2025-02-19 15:29:03+00:00,"This article has been reviewed according to Science X's editorial process and policies . Editors have highlighted the following attributes while ensuring the content's credibility:

Credit: Rann Vijay...",science,Incheon National University,Yes,Real
A robust and adaptive controller for ballbots,https://scx2.b-cdn.net/gfx/news/hires/2025/a-robust-and-adaptive-1.jpg,2025-02-19 15:24:04+00:00,"This article has been reviewed according to Science X's editorial process and policies . Editors have highlighted the following attributes while ensuring the content's credibility:

The structure of b...",science,Shibaura Institute Of Technology,Unknown,Unknown
Researchers examine benefits of group purchasing for health care supplies,https://scx2.b-cdn.net/gfx/news/2025/researchers-examine-be.jpg,2025-02-19 15:23:47+00:00,"This article has been reviewed according to Science X's editorial process and policies . Editors have highlighted the following attributes while ensuring the content's credibility:

Credit: Jordan Opp...","medical, science",University Of Nebraska-Lincoln,Yes,Real
What's on the horizon for Australia's road safety?,https://scx2.b-cdn.net/gfx/news/hires/2023/car-crash.jpg,2025-02-19 15:22:47+00:00,"This article has been reviewed according to Science X's editorial process and policies . Editors have highlighted the following attributes while ensuring the content's credibility:

Credit: Pixabay/CC...",science,Flinders University,Yes,Real
AI-designed spatial gene map identifies early markers of idiopathic pulmonary fibrosis,https://scx2.b-cdn.net/gfx/news/hires/2025/nature-ai-made-lung-di.jpg,2025-02-19 15:22:03+00:00,"This article has been reviewed according to Science X's editorial process and policies . Editors have highlighted the following attributes while ensuring the content's credibility:

Outline of spatial...","medical, science",St Vincent'S Institute Of Medical Research,Yes,Real
Lifetime of semiconductor processing equipment parts can be checked in real time,https://scx2.b-cdn.net/gfx/news/hires/2025/lifetime-of-semiconduc-1.jpg,2025-02-19 15:19:03+00:00,"This article has been reviewed according to Science X's editorial process and policies . Editors have highlighted the following attributes while ensuring the content's credibility:

The real-time syst...",science,National Research Council Of Science,Yes,Real
New study finds dementia cases will double by 2060,"https://kubrick.htvapps.com/vidthumb/33fbe5f6-2c11-4362-8ba0-cc01ec59da6f/60fb5854-276b-4b14-9eee-693b1fbe7f4c.jpg?crop=1xw:1.0xh;center,top&resize=640:*",2025-02-19 15:18:00+00:00,"Dr. Peter Gliebus, director of cognitive and behavioral neurology at Marcus Neuroscience Institute, spoke to WPBF 25 about the new findings.","regional, west-palm-beach, florida",wpbf,Yes,Real
Novel 'pruning' technique shows promise for reducing AI bias without harming performance,https://scx2.b-cdn.net/gfx/news/2025/new-study-takes-novel-1.jpg,2025-02-19 15:16:05+00:00,"This article has been reviewed according to Science X's editorial process and policies . Editors have highlighted the following attributes while ensuring the content's credibility:

Illustration of th...",science,Monica Schreiber,Yes,Real
"War study in Ukraine suggests hydrodissection may reduce pain, opioid use in post-amputation pain",https://scx2.b-cdn.net/gfx/news/hires/2023/ukraine-1.jpg,2025-02-19 15:13:04+00:00,"This article has been reviewed according to Science X's editorial process and policies . Editors have highlighted the following attributes while ensuring the content's credibility:

Credit: Unsplash/C...","medical, science",Northwestern University,No,Real
"Dogs blink more in response to other dogs doing the same, hinting at social connection",https://scx2.b-cdn.net/gfx/news/2025/dogs-blink-more-in-res-1.jpg,2025-02-19 15:10:01+00:00,"A team of life scientists at the University of Parma in Italy has found that dogs tend to blink more in response to other dogs doing the same. In their study published in the journal Royal Society Open Science, the group conducted lab experiments with dogs watching videos of other dogs blinking.","science, physics",Bob Yirka,Yes,Real
Researchers describe new molecular mechanisms linked to insulin resistance,https://scx2.b-cdn.net/gfx/news/2025/researchers-describe-n.jpg,2025-02-19 15:06:03+00:00,"This article has been reviewed according to Science X's editorial process and policies . Editors have highlighted the following attributes while ensuring the content's credibility:

Credit: Cell Commu...","medical, science",University Of Barcelona,Yes,Real
"Transforming HIV diagnosis: A low-cost, point-of-care detection solution",https://scx2.b-cdn.net/gfx/news/hires/2025/transforming-hiv-diagn-1.jpg,2025-02-19 14:41:18+00:00,"This article has been reviewed according to Science X's editorial process and policies . Editors have highlighted the following attributes while ensuring the content's credibility:

Detection specific...","medical, science",Aerospace Information Research Institute,Yes,Real
Understanding AI decision-making: Research examines model transparency,https://scx2.b-cdn.net/gfx/news/hires/2025/understanding-ai-decis.jpg,2025-02-19 14:41:02+00:00,"This article has been reviewed according to Science X's editorial process and policies . Editors have highlighted the following attributes while ensuring the content's credibility:

The SAGE framework...",science,Georgie Gould,Yes,Real
Discovery reveals key protein that helps squamous cell carcinoma resist ferroptosis,https://scx2.b-cdn.net/gfx/news/hires/2025/new-discovery-reveals.jpg,2025-02-19 14:40:47+00:00,"This article has been reviewed according to Science X's editorial process and policies . Editors have highlighted the following attributes while ensuring the content's credibility:

A model illustrati...","medical, science",Zhang Nannan,Yes,Real
"Lifestyle and environmental factors affect health and aging more than our genes, study finds",https://scx2.b-cdn.net/gfx/news/hires/2024/aging-1.jpg,2025-02-19 14:34:05+00:00,"This article has been reviewed according to Science X's editorial process and policies . Editors have highlighted the following attributes while ensuring the content's credibility:

Credit: Pixabay/CC...","medical, science",University Of Oxford,Unknown,Unknown
Crushed Titanic chandelier that hung in first-class smoking lounge heads to museum,https://a57.foxnews.com/static.foxnews.com/foxnews.com/content/uploads/2025/02/1024/512/titanic-2-1.jpg?ve=1&tl=1,2025-02-19 14:30:40+00:00,"A 20-pound chandelier that hung in the RMS Titanic has arrived at the Liberty Science Center in Jersey City, New Jersey, after spending decades sitting on the bottom of the Atlantic.",general,Fox News,Yes,Real
Atrandi Biosciences Raises $25M Series A Led by Lux Capital to Drive the Future of Single-Cell Multiomics with Semi-Permeable Capsule Technology,/next-assets/images/schema-image-default.png,2025-02-19 13:00:00+00:00,"VILNIUS, Lithuania, Feb. 19, 2025 (GLOBE NEWSWIRE) -- Atrandi Biosciences, a life sciences company pioneering next-generation single-cell analysis technology, today announced a $25 million Series A funding round led by",finance,Globe Newswire,Unknown,Unknown
Trump’s DEI Purge Is Hitting NASA Hard,https://static.scientificamerican.com/dam/m/1e50dc1995e7d2c5/original/NASA_astronauts_class-of-2021.jpg?m=1739983568.128&w=1200,2025-02-19 13:00:00+00:00,"Space scientists within NASA and outside it feel betrayed by the Trump administration’s changes at the agency, which was known for promoting inclusion in science",science,"Alexandra Witze, Nature magazine",Unknown,Unknown
Precision Bio gains on early Phase 1 data for Hep B candidate,https://static.seekingalpha.com/cdn/s3/uploads/getty_images/1040300740/image_1040300740.jpg?io=getty-c-w750,2025-02-19 12:53:44+00:00,Precision BioSciences (NASDAQ:DTIL) added ~6% in the premarket on Wednesday after the gene therapy developer announced initial safety and efficacy data from an early-stage trial for its Hepatitis B ca...,"business, finance",SeekingAlpha.com,Unknown,Unknown
New paper-based device boosts HIV test accuracy from dried blood samples,https://scx2.b-cdn.net/gfx/news/hires/2025/new-paper-based-device-1.jpg,2025-02-19 12:51:04+00:00,"This article has been reviewed according to Science X's editorial process and policies . Editors have highlighted the following attributes while ensuring the content's credibility:

Sample spot cards....","medical, science",Joseph Caputo,Unknown,Unknown
Visualization technique depicts brain-wide activity change as geometric patterns,https://scx2.b-cdn.net/gfx/news/hires/2025/visualization-techniqu.jpg,2025-02-19 12:49:03+00:00,"This article has been reviewed according to Science X's editorial process and policies . Editors have highlighted the following attributes while ensuring the content's credibility:

Quantitative evalu...","medical, science",University Of Tsukuba,Yes,Real
Reducing DNA repair protein levels to target root cause of Huntington's disease,https://scx2.b-cdn.net/gfx/news/hires/2025/reducing-dna-repair-pr.jpg,2025-02-19 12:43:04+00:00,"This article has been reviewed according to Science X's editorial process and policies . Editors have highlighted the following attributes while ensuring the content's credibility:

Immunofluorescent ...","medical, science",University College London,Unknown,Unknown
Make America Healthy Again agenda at risk with reduction in force across federal health agencies,https://scx2.b-cdn.net/gfx/news/hires/2023/health-care-worker.jpg,2025-02-19 12:41:22+00:00,"This article has been reviewed according to Science X's editorial process and policies . Editors have highlighted the following attributes while ensuring the content's credibility:

Credit: Unsplash/C...","medical, science",Society For Healthcare Epidemiology Of America,Unknown,Unknown
"Drug can stave off organ damage from lupus, research reveals",https://scx2.b-cdn.net/gfx/news/2025/drug-can-stave-off-org.jpg,2025-02-19 12:40:33+00:00,"This article has been reviewed according to Science X's editorial process and policies . Editors have highlighted the following attributes while ensuring the content's credibility:

Lupus can do irrev...","medical, science",Dennis Thompson,Unknown,Unknown
"Arthritis sufferers don't get the mental health support they need, study says",https://scx2.b-cdn.net/gfx/news/2025/arthritis-sufferers-do.jpg,2025-02-19 12:40:20+00:00,"This article has been reviewed according to Science X's editorial process and policies . Editors have highlighted the following attributes while ensuring the content's credibility:

People with inflam...","medical, science",Dennis Thompson,Unknown,Unknown
Miami Digital Real Estate Summit 2025: A Groundbreaking Look into the Future of Smart Cities and Real Estate Innovation,/next-assets/images/schema-image-default.png,2025-02-19 12:10:22+00:00,"Miami, FL, Feb. 19, 2025 (GLOBE NEWSWIRE) -- - The Miami Digital Real Estate Summit, hosted by Magma at the Phillip &amp; Patricia Frost Museum of Science on February 11, 2025, brought together industry pioneers,",finance,Globe Newswire,Unknown,Unknown
"Many adults stop GLP-1 therapy within a year with low restart rates, analysis finds",https://scx2.b-cdn.net/gfx/news/hires/2022/weight-1.jpg,2025-02-19 12:10:01+00:00,"This article has been reviewed according to Science X's editorial process and policies . Editors have highlighted the following attributes while ensuring the content's credibility:

Credit: Unsplash/C...","medical, science",Justin Jackson,Yes,Real
How a curious polymer could prevent blood clotting in medical implants,https://scx2.b-cdn.net/gfx/news/hires/2025/how-a-curious-polymer.jpg,2025-02-19 12:01:04+00:00,"This article has been reviewed according to Science X's editorial process and policies . Editors have highlighted the following attributes while ensuring the content's credibility:

A spiral painted i...","medical, science",University Of Sydney,Yes,Real
"We are no longer living longer, study shows",https://scx2.b-cdn.net/gfx/news/hires/2016/57f6ba8e69232.jpg,2025-02-19 11:57:06+00:00,"This article has been reviewed according to Science X's editorial process and policies . Editors have highlighted the following attributes while ensuring the content's credibility:

Credit: CC0 Public...","medical, science",University Of East Anglia,Yes,Real
"Daily drug can mimic health benefits of high-altitude, low-oxygen living for mitochondrial disease",https://scx2.b-cdn.net/gfx/news/hires/2025/daily-drug-can-mimic-h.jpg,2025-02-19 11:35:05+00:00,"This article has been reviewed according to Science X's editorial process and policies . Editors have highlighted the following attributes while ensuring the content's credibility:

The scientists sho...","medical, science",Sarah C.P. Williams,Yes,Real
UR Medicine's Fitness Science offers free sports bra fittings,https://s7d2.scene7.com/is/image/TWCNews/sportsbra,2025-02-19 11:30:00+00:00,Medical research shows eight out 10 women are wearing the wrong-sized sports bra.,"regional, rochester, new-york",Wendy Mills,Yes,Real
Study examines pros and cons of aggressive blood pressure lowering in older adults,https://scx2.b-cdn.net/gfx/news/hires/2023/blood-pressure-2.jpg,2025-02-19 11:16:03+00:00,"This article has been reviewed according to Science X's editorial process and policies . Editors have highlighted the following attributes while ensuring the content's credibility:

Credit: Unsplash/C...","medical, science",medicalxpress,Yes,Real
Would the prohibition of menthol cigarettes cause more harm than good?,https://scx2.b-cdn.net/gfx/news/hires/2022/quit-smoking.jpg,2025-02-19 11:12:03+00:00,"This article has been reviewed according to Science X's editorial process and policies . Editors have highlighted the following attributes while ensuring the content's credibility:

Credit: Pixabay/CC...","medical, science",medicalxpress,Yes,Real
Research indicates that neuroestrogens help suppress appetite,https://scx2.b-cdn.net/gfx/news/hires/2022/eating.jpg,2025-02-19 11:09:03+00:00,"This article has been reviewed according to Science X's editorial process and policies . Editors have highlighted the following attributes while ensuring the content's credibility:

Credit: Unsplash/C...","medical, science",medicalxpress,Yes,Real
"Newborns experiencing neonatal seizures face an elevated risk of developing epilepsy, study shows",https://scx2.b-cdn.net/gfx/news/hires/2023/newborn-1.jpg,2025-02-19 11:08:03+00:00,"This article has been reviewed according to Science X's editorial process and policies . Editors have highlighted the following attributes while ensuring the content's credibility:

Credit: Unsplash/C...","medical, science",medicalxpress,Yes,Real
Trump says there are 'two sexes.' Experts and science say it's not binary.,https://www.washingtonpost.com/wp-apps/imrs.php?src=https://arc-anglerfish-washpost-prod-washpost.s3.amazonaws.com/public/7NWVPHUGOBSEXLVW4JXWGTNKGQ.jpg&w=1440,2025-02-19 11:00:35+00:00,"On the first day of his second administration, President Donald Trump signed an executive order declaring that the United States recognizes “two sexes, male and female” — but according to experts and ...",politics,Kelsey Ables,Unknown,Unknown
Why retractions data could be a powerful tool for cleaning up science,https://media.nature.com/lw1200/magazine-assets/d41586-025-00509-1/d41586-025-00509-1_50649122.jpg,2025-02-19 10:58:44+00:00,"The number of retracted papers has been rising over the past few years.Credit: Priscila Zambotto/Getty

Many universities and research institutions around the world prize high productivity. They encou...",academia,nature,Yes,Real
Rangers to euthanise 90 dolphins stranded on remote Australian beach,https://scx2.b-cdn.net/gfx/news/2025/dolphins-stranded-on-a.jpg,2025-02-19 09:30:02+00:00,"This article has been reviewed according to Science X's editorial process and policies . Editors have highlighted the following attributes while ensuring the content's credibility:

Dolphins stranded ...",science,phys,Yes,Real
Indonesia’s Prabowo Replaces Aide in First Cabinet Reshuffle,https://assets.bwbx.io/images/users/iqjWHBFdfxIU/iHr_947aSqWg/v1/1200x800.jpg,2025-02-19 08:46:03+00:00,"Indonesian President Prabowo Subianto named Brian Yuliarto as the new higher education, science and technology minister in his first cabinet reshuffle after taking office last year.",general,Unknown,Yes,Real
New in Peru: 27 species previously undiscovered by science,https://media.npr.org/assets/img/2025/02/18/2.19.25-ep_wide-b7fac88b453291aebdedf7d9b7c6613ceba2e72a.jpg?s=1400&c=100&f=jpeg,2025-02-19 08:00:59+00:00,"What happens when a team of scientists and local Awajún guides go on a 38-day trip into the Alto Mayo region of Peru? Over 2000 species are identified, of course! Tucked in this lush landscape where the Amazon basin meets the Andes mountains, were 27 species of animals previously unknown to science....",science,Regina G. Barber,Unknown,Unknown
Sea turtles return to the Atlantic Ocean off Florida after being stunned by the cold,https://scx2.b-cdn.net/gfx/news/hires/2025/sea-turtles-return-to.jpg,2025-02-19 06:55:23+00:00,"This article has been reviewed according to Science X's editorial process and policies . Editors have highlighted the following attributes while ensuring the content's credibility:

A green sea turtle...",science,phys,Yes,Real
City killer' asteroid now has 3.1% chance of hitting Earth: NASA,https://scx2.b-cdn.net/gfx/news/2025/this-handout-picture-p-1.jpg,2025-02-19 06:53:27+00:00,"This article has been reviewed according to Science X's editorial process and policies . Editors have highlighted the following attributes while ensuring the content's credibility:

This handout pictu...",science,Issam Ahmed With Daniel Lawler In Paris,Yes,Real
tn4ml: Tensor Network Training and Customization for Machine Learning,https://static.arxiv.org/icons/twitter/arxiv-logo-twitter-square.png,2025-02-19 05:00:00+00:00,"Tensor Networks have emerged as a prominent alternative to neural networks for addressing Machine Learning challenges in foundational sciences, paving the way for their applications to real-life problems. This paper introduces tn4ml, a novel library designed to seamlessly integrate Tensor Networks i...","academic, CS","Pierini, Maurizio",Unknown,Unknown
NaturalReasoning: Reasoning in the Wild with 2.8M Challenging Questions,https://static.arxiv.org/icons/twitter/arxiv-logo-twitter-square.png,2025-02-19 05:00:00+00:00,"Scaling reasoning capabilities beyond traditional domains such as math and coding is hindered by the lack of diverse and high-quality questions. To overcome this limitation, we introduce a scalable approach for generating diverse and challenging reasoning questions, accompanied by reference answers....","academic, CS","Li, Xian",No,Real
