title,image,published,description,category,author,image_relation,fake_news_label
Intra-arterial tenecteplase beneficial for large vessel occlusion,https://scx2.b-cdn.net/gfx/news/2025/asa-intra-arterial-ten.jpg,2025-02-18 17:22:51+00:00,"This article has been reviewed according to Science X's editorial process and policies . Editors have highlighted the following attributes while ensuring the content's credibility:

For patients with ...","medical, science",Elana Gotkine,Unknown,Unknown
Testosterone recovery linked to overall survival in high-risk prostate cancer,https://scx2.b-cdn.net/gfx/news/2025/testosterone-recovery.jpg,2025-02-18 17:22:39+00:00,"This article has been reviewed according to Science X's editorial process and policies . Editors have highlighted the following attributes while ensuring the content's credibility:

Serum testosterone...","medical, science",Elana Gotkine,Unknown,Unknown
Mobile prostate cancer screening clinic can ID the disease in disadvantaged men,https://scx2.b-cdn.net/gfx/news/2025/mobile-prostate-cancer.jpg,2025-02-18 17:22:29+00:00,"This article has been reviewed according to Science X's editorial process and policies . Editors have highlighted the following attributes while ensuring the content's credibility:

A ""Man Van"" deploy...","medical, science",Elana Gotkine,Unknown,Unknown
"Mending a broken heart: Two types of scars in injured cardiac tissue, two paths to healing",https://scx2.b-cdn.net/gfx/news/2025/a-broken-heart-two-typ.jpg,2025-02-18 17:21:05+00:00,"This article has been reviewed according to Science X's editorial process and policies . Editors have highlighted the following attributes while ensuring the content's credibility:

Painting a new pic...","medical, science",Weizmann Institute Of Science,Unknown,Unknown
External factors that could lead to dissociation in young people revealed,https://scx2.b-cdn.net/gfx/news/hires/2023/young-person.jpg,2025-02-18 17:19:08+00:00,"This article has been reviewed according to Science X's editorial process and policies . Editors have highlighted the following attributes while ensuring the content's credibility:

Credit: Pixabay/CC...","medical, science",University Of Birmingham,Yes,Real
Discovery of new fat cell subtypes in the human body could advance personalized obesity treatment,https://scx2.b-cdn.net/gfx/news/hires/2025/new-subtypes-of-fat-ce.jpg,2025-02-18 17:16:05+00:00,"This article has been reviewed according to Science X's editorial process and policies . Editors have highlighted the following attributes while ensuring the content's credibility:

Adipocyte-specific...","medical, science",Ben-Gurion University Of The Negev,Unknown,Unknown
Deadline Alert: Integral Ad Science Holding Corp. (IAS) Investors Who Lost Money Urged To Contact Glancy Prongay & Murray LLP About Securities Fraud Lawsuit,https://www.benzinga.com/next-assets/images/schema-image-default.png,2025-02-18 17:00:00+00:00,"LOS ANGELES, Feb. 18, 2025 (GLOBE NEWSWIRE) -- Glancy Prongay & Murray LLP reminds investors of the upcoming March 31, 2025 deadline to file a lead plaintiff motion in the class action filed on behalf...","finance, legal",Globe Newswire,No,Real
Tweets and AI models reveal heat stroke risks in urban areas,https://scx2.b-cdn.net/gfx/news/hires/2025/social-media-posts-and.jpg,2025-02-18 16:57:04+00:00,"This article has been reviewed according to Science X's editorial process and policies . Editors have highlighted the following attributes while ensuring the content's credibility:

Researchers from J...","medical, science",Sophia University,Yes,Real
Scientists develop 'smart pajamas' to monitor sleep disorders,https://scx2.b-cdn.net/gfx/news/hires/2025/scientists-develop-sma-1.jpg,2025-02-18 16:51:04+00:00,"This article has been reviewed according to Science X's editorial process and policies . Editors have highlighted the following attributes while ensuring the content's credibility:

Overview of the sm...","medical, science",University Of Cambridge,Unknown,Unknown
Gene editing reveals enzyme's role in placental health during pregnancy,https://scx2.b-cdn.net/gfx/news/2025/new-clues-to-a-healthy.jpg,2025-02-18 16:41:03+00:00,"This article has been reviewed according to Science X's editorial process and policies . Editors have highlighted the following attributes while ensuring the content's credibility:

Credit: Cell Death...","medical, science",Flinders University,Yes,Real
Running the gauntlet to get pregnant when you're LGBTQ+,https://scx2.b-cdn.net/gfx/news/2025/running-the-gauntlet-t.jpg,2025-02-18 16:38:04+00:00,"This article has been reviewed according to Science X's editorial process and policies . Editors have highlighted the following attributes while ensuring the content's credibility:

Zoé Benoît, Kather...",science,Catherine Couturier,Yes,Real
New study evaluates public policy preferences for limiting children's access to energy drinks,https://scx2.b-cdn.net/gfx/news/2025/new-study-evaluates-pu.jpg,2025-02-18 16:37:23+00:00,"This article has been reviewed according to Science X's editorial process and policies . Editors have highlighted the following attributes while ensuring the content's credibility:

A new paper co-wri...",science,Phil Ciciora,Yes,Real
Woman in cancer remission for record 19 years after CAR-T immune treatment,https://media.nature.com/lw1200/magazine-assets/d41586-025-00507-3/d41586-025-00507-3_50648950.jpg,2025-02-18 16:36:43+00:00,"A CAR-T cell (orange) attacks a cancer cell (green), which is starting to contract.Credit: Eye Of Science/Science Photo Library

The girl was four years old when she arrived at Texas Children’s Hospit...",academia,Ledford,Yes,Real
Unconventional' nickel superconductor excites physicists,https://media.nature.com/lw1200/magazine-assets/d41586-025-00450-3/d41586-025-00450-3_50653332.jpg,2025-02-18 16:36:43+00:00,"Superconductors would make make many technologies radically more efficient.Credit: Patrick Gaillardin/Look At Sciences/SPL

A new family of superconductors is exciting physicists. Compounds containing...",academia,Gibney,Unknown,Unknown
Quantitative method evaluates disaster resilience in building energy systems,https://scx2.b-cdn.net/gfx/news/hires/2018/solarpowerpl.jpg,2025-02-18 16:30:03+00:00,"This article has been reviewed according to Science X's editorial process and policies . Editors have highlighted the following attributes while ensuring the content's credibility:

Credit: CC0 Public...",science,University Of Tsukuba,Yes,Real
Potential target for multiple sclerosis therapy discovered,https://scx2.b-cdn.net/gfx/news/hires/2025/potential-target-for-m.jpg,2025-02-18 16:21:03+00:00,"This article has been reviewed according to Science X's editorial process and policies . Editors have highlighted the following attributes while ensuring the content's credibility:

Under the microsco...","medical, science",Inka Väth,Yes,Real
Sudden vision loss in children: Study in China points to a novel retinal disorder,https://scx2.b-cdn.net/gfx/news/2025/hord-study-in-china-po.jpg,2025-02-18 16:20:01+00:00,"This article has been reviewed according to Science X's editorial process and policies . Editors have highlighted the following attributes while ensuring the content's credibility:

A 6-year-old girl ...","medical, science",Justin Jackson,Yes,Real
EU consumers don't trust US goods: A look into Trump's trade deficit claims,https://scx2.b-cdn.net/gfx/news/hires/2025/american-products.jpg,2025-02-18 16:16:27+00:00,"This article has been reviewed according to Science X's editorial process and policies . Editors have highlighted the following attributes while ensuring the content's credibility:

Credit: Pixabay/CC...",science,Waya Quiviger,Unknown,Unknown
Uncovering inequalities in breast cancer immunotherapy access,https://scx2.b-cdn.net/gfx/news/2025/uncovering-inequalitie.jpg,2025-02-18 16:14:05+00:00,"This article has been reviewed according to Science X's editorial process and policies . Editors have highlighted the following attributes while ensuring the content's credibility:

Estimated prevalen...","medical, science",University Of Chicago Medical Center,Yes,Real
Grid cells' rhythmic sweeps reshape understanding of brain's spatial navigation,https://scx2.b-cdn.net/gfx/news/2025/grid-cell-networks-map.jpg,2025-02-18 16:11:06+00:00,"This article has been reviewed according to Science X's editorial process and policies . Editors have highlighted the following attributes while ensuring the content's credibility:

Ten times per seco...","medical, science",Rita Elmkvist Nilsen,Yes,Real
"Even after learning the right idea, humans and animals still seem to test other approaches",https://scx2.b-cdn.net/gfx/news/hires/2025/idea.jpg,2025-02-18 16:00:11+00:00,"This article has been reviewed according to Science X's editorial process and policies . Editors have highlighted the following attributes while ensuring the content's credibility:

Credit: Pixabay/CC...","medical, science",Massachusetts Institute Of Technology,Yes,Real
Exoplanet with iron rain has violent winds 'like something out of science fiction',https://s.yimg.com/ny/api/res/1.2/bYhSJWMJVIaUBpsEhv1XQg--/YXBwaWQ9aGlnaGxhbmRlcjt3PTEyMDA7aD02NzU-/https://media.zenfs.com/en/space_311/58256583292f83d359e9e202bee06e85,2025-02-18 16:00:00+00:00,Astronomers have discovered a powerful jet stream raging through the atmosphere of an ultra-hot Jupiter exoplanet ravaged by liquid iron rains.,general,Robert Lea,Unknown,Unknown
"ABC-7 at 4: EPWater, TecH2O Learning Center host annual DiscoverE",https://kvia.com/wp-content/uploads/2025/02/DiscoverE-1.png,2025-02-18 15:42:44+00:00,"El Paso, TX (KVIA-TV)—EPWater, TecH2O Learning Center host the annual DiscoverEFree event to inspire the next generation of engineers. The free family event will celebrate engineers and engage students and their families on Saturday, February 22, from 11:00 a.m. to 3 p.m. DiscoverE will offer new an...","regional, el-paso, texas, education",Nichole Gomez,Yes,Real
The true toll of a transient ischemic attack may be found in accelerated cognitive decline,https://scx2.b-cdn.net/gfx/news/hires/2025/cognitive-decline.jpg,2025-02-18 15:30:01+00:00,"This article has been reviewed according to Science X's editorial process and policies . Editors have highlighted the following attributes while ensuring the content's credibility:

Credit: Pixabay/CC...","medical, science",Justin Jackson,Unknown,Unknown
Meta plans undersea cable to link five continents,https://scx2.b-cdn.net/gfx/news/2025/digital-giants-like-me.jpg,2025-02-18 15:23:07+00:00,"This article has been reviewed according to Science X's editorial process and policies . Editors have highlighted the following attributes while ensuring the content's credibility:

Digital giants lik...",science,techxplore,Unknown,Unknown
Archaeologists discover oldest evidence of stone blade production on the Arabian Peninsula,https://scx2.b-cdn.net/gfx/news/hires/2025/oldest-evidence-of-sto.jpg,2025-02-18 15:21:29+00:00,"This article has been reviewed according to Science X's editorial process and policies . Editors have highlighted the following attributes while ensuring the content's credibility:

Examples of retouc...",science,Bob Yirka,Unknown,Unknown
Entrepreneurship fear of failure on the rise,https://scx2.b-cdn.net/gfx/news/hires/2025/entrepreneurship-fear.jpg,2025-02-18 15:05:05+00:00,"This article has been reviewed according to Science X's editorial process and policies . Editors have highlighted the following attributes while ensuring the content's credibility:

Credit: Global Ent...",science,University Of Glasgow,Unknown,Unknown
"AI model automatically segments MRI images, reducing radiologist workload",https://scx2.b-cdn.net/gfx/news/hires/2025/researchers-develop-ai-1.jpg,2025-02-18 15:00:03+00:00,"This article has been reviewed according to Science X's editorial process and policies . Editors have highlighted the following attributes while ensuring the content's credibility:

Example MRI scans ...","medical, science",Radiological Society Of North America,Yes,Real
Racial disparities seen in care after abnormal mammograms,https://scx2.b-cdn.net/gfx/news/hires/2023/mammogram.jpg,2025-02-18 15:00:02+00:00,"This article has been reviewed according to Science X's editorial process and policies . Editors have highlighted the following attributes while ensuring the content's credibility:

Credit: Unsplash/C...","medical, science",University Of Washington School Of Medicine,Yes,Real
"Abortion bans in the US linked to increased births and infant mortality, studies find",https://scx2.b-cdn.net/gfx/news/hires/2025/black-baby-2.jpg,2025-02-18 14:50:01+00:00,"This article has been reviewed according to Science X's editorial process and policies . Editors have highlighted the following attributes while ensuring the content's credibility:

Credit: Unsplash/C...","medical, science",Justin Jackson,Yes,Real
Can public trust in science survive a second battering?,https://cdn.arstechnica.net/wp-content/uploads/2025/02/science-protest-1024x648.jpg,2025-02-18 14:35:53+00:00,"Public trust in science has shown a certain resiliency, but it is being tested like never before.",technology,Undark Magazine,Unknown,Unknown
AI in journalism: Report reveals audience distrust and ethical concerns,https://scx2.b-cdn.net/gfx/news/hires/2025/ai-and-journalism.jpg,2025-02-18 14:32:04+00:00,"This article has been reviewed according to Science X's editorial process and policies . Editors have highlighted the following attributes while ensuring the content's credibility:

Credit: Pixabay/CC...",science,Aeden Ratcliffe,Unknown,Unknown
"Medtronic Q3 Earnings: Cardiovascular And Neuroscience Drive Growth, Surgical Revenue Dips, Reaffirms Annual Forecast",https://cdn.benzinga.com/files/images/story/2025/02/18/Chicago--Illinois--Usa--Aug-31--2023--Me.jpeg?width=1200&height=800&fit=crop,2025-02-18 14:30:15+00:00,"Medtronic reported Q3 revenue of $8.29 billion, missing estimates, while EPS of $1.39 topped forecasts. The company reaffirmed its FY25 organic growth guidance.",finance,Vandana Singh,Yes,Real
"Leisure-time physical activity is key for type 2 diabetes risk reduction, research shows",https://scx2.b-cdn.net/gfx/news/hires/2018/2-physicalacti.jpg,2025-02-18 14:14:05+00:00,"This article has been reviewed according to Science X's editorial process and policies . Editors have highlighted the following attributes while ensuring the content's credibility:

Credit: CC0 Public...","medical, science",medicalxpress,Unknown,Unknown
HIV protein switch may help virus squeeze into host cell nucleus,https://scx2.b-cdn.net/gfx/news/hires/2022/hiv-2.jpg,2025-02-18 14:02:14+00:00,"This article has been reviewed according to Science X's editorial process and policies . Editors have highlighted the following attributes while ensuring the content's credibility:

Credit: Pixabay/CC...","medical, science",Pittsburgh Supercomputing Center,Yes,Real
Science Crossword: Creative Bursts,https://static.scientificamerican.com/dam/m/1d759b538f62dbef/original/Games-AllGamesIcon.jpg?m=1720649253.362,2025-02-18 14:00:00+00:00,Play this crossword inspired by the March 2025 issue of Scientific American.,science,scientificamerican,Yes,Real
"Science History from 50, 100 and 150 Years Ago",https://static.scientificamerican.com/dam/m/79c80667491e31a5/original/sa0325Hist01.jpg?m=1739544125.484&w=1200,2025-02-18 14:00:00+00:00,Color blindness; the end of fire,science,Mark Fischetti,Yes,Real
"Poem: ‘(origins, positrons)’",https://static.scientificamerican.com/dam/m/3ecbb449e213513e/original/sa0325MetrCrop.jpg?m=1738865105.001&w=1200,2025-02-18 14:00:00+00:00,Science in meter and verse,science,"Julia Nelsen, Fabiano Alborghetti",Unknown,Unknown
Immigration Fuels Innovation in Science to Make the U.S. More Competitive,https://static.scientificamerican.com/dam/m/452a90bb443908f4/original/sa0325Agnd01.jpg?m=1738858905.569&w=1200,2025-02-18 14:00:00+00:00,The U.S. will need more than one million STEM workers in the next 10 years to stay competitive. Immigrants are critical to that future,science,The Editors,Yes,Real
Taking a break from smartphones: Study confirms its benefits,https://scx2.b-cdn.net/gfx/news/hires/2025/benefits-of-taking-a-b.jpg,2025-02-18 13:57:03+00:00,"This article has been reviewed according to Science X's editorial process and policies . Editors have highlighted the following attributes while ensuring the content's credibility:

Attention, mental ...","medical, science",Pnas Nexus,Yes,Real
Using CRISPR to remove extra chromosomes in Down syndrome,https://scx2.b-cdn.net/gfx/news/hires/2025/using-crispr-to-remove.jpg,2025-02-18 13:55:03+00:00,"This article has been reviewed according to Science X's editorial process and policies . Editors have highlighted the following attributes while ensuring the content's credibility:

A graphical abstra...","medical, science",Pnas Nexus,Yes,Real
Neuro-inspired AI framework uses reverse-order learning to enhance code generation,https://scx2.b-cdn.net/gfx/news/hires/2025/a-neurobiology-inspire.jpg,2025-02-18 13:50:01+00:00,"This article has been reviewed according to Science X's editorial process and policies . Editors have highlighted the following attributes while ensuring the content's credibility:

Overview of Cogito...",science,Ingrid Fadelli,Yes,Real
Duchenne gene therapy from Solid Biosciences produces promising results in early study,https://www.statnews.com/wp-content/uploads/2021/12/GettyImages-1076619156-1024x576.jpg,2025-02-18 13:35:01+00:00,"Solid said that the first patients to receive its Duchenne gene therapy all produced high levels of the target protein, an early sign of promise",medical,Jason Mast,Yes,Real
"With just 5 years to go, the world is failing on a vital deal to halt biodiversity loss, research suggests",https://scx2.b-cdn.net/gfx/news/hires/2025/with-just-5-years-to-g.jpg,2025-02-18 13:10:01+00:00,"This article has been reviewed according to Science X's editorial process and policies . Editors have highlighted the following attributes while ensuring the content's credibility:

Countries that sub...",science,Justine Bell-James,Yes,Real
Study sheds light on how people's DNA affects their response to smoking cessation drug,https://scx2.b-cdn.net/gfx/news/hires/2019/3-dna.jpg,2025-02-18 13:01:01+00:00,"This article has been reviewed according to Science X's editorial process and policies . Editors have highlighted the following attributes while ensuring the content's credibility:

DNA, which has a d...","medical, science",University Of Leicester,Unknown,Unknown
"Australian houses are getting larger: For a more sustainable future, houses can't be the space for everything",https://scx2.b-cdn.net/gfx/news/hires/2024/australian-houses.jpg,2025-02-18 12:54:24+00:00,"This article has been reviewed according to Science X's editorial process and policies . Editors have highlighted the following attributes while ensuring the content's credibility:

Credit: Unsplash/C...",science,Bhavna Middha,Unknown,Unknown
"Kentucky Retirement Systems Insurance Trust Fund Has $5.02 Million Stock Position in Gilead Sciences, Inc. (NASDAQ:GILD)",https://www.marketbeat.com/logos/Gilead_Sciences_Pty_Ltd-1200x675.jpg,2025-02-18 12:11:50+00:00,"Kentucky Retirement Systems Insurance Trust Fund grew its stake in shares of Gilead Sciences, Inc. (NASDAQ:GILD - Free Report) by 47.3% in the 4th quarter, according to its most recent Form 13F filing with the Securities & Exchange Commission. The fund owned 54,300 shares of the biopharmaceutic",finance,MarketBeat,Unknown,Unknown
The Technocracy Movement and Howard Scott,https://cdn.mises.org/styles/social_media/s3/images/2025-02/AdobeStock_Technocracy.jpeg?itok=cjLZ6q4l' + og_image: 'https://cdn.mises.org/styles/social_media/s3/images/2025-02/AdobeStock_Technocracy.jpeg?itok=cjLZ6q4l,2025-02-18 11:02:18+00:00,"The Technocracy Movement was an offshoot of progressivism, and adherents believed that science and technology were the keys to creating a new Utopia. Not",economy,Lukas Organ,Unknown,Unknown
It’s the end of the world as I know it. And I feel fine.,https://sciencebasedmedicine.org/wp-content/uploads/2025/02/BeforeAfter.png,2025-02-18 11:00:00+00:00,"Pondering the future of a few infections. As to the image, consider it a metaphor of before and after where Jesus is a stand in for science or public health or whatever you want him to be. Except a p",science,Mark Crislip,Yes,Fake
Censored Science Can't Save Lives,https://static01.nyt.com/images/2025/02/10/opinion/10alladina-hardin-rabin-img/10alladina-hardin-rabin-img-facebookJumbo.jpg,2025-02-18 10:00:53+00:00,Censoring research on how to deliver treatments to those most in need isn’t just nonsensical — it puts lives at risk and undermines America’s leadership in medical innovation. Progress cannot occur if...,general,Jehan Alladina,Unknown,Unknown
Gold nanodots can help boost cancer cell response to ultrasound treatment,https://scx2.b-cdn.net/gfx/news/hires/2025/tweaking-cancer-cell-r.jpg,2025-02-18 08:20:01+00:00,"This article has been reviewed according to Science X's editorial process and policies . Editors have highlighted the following attributes while ensuring the content's credibility:

ECM spacing of 50–...",science,Ranjini Raghunath,Yes,Real
Expanded understanding of how antibodies fight canine parvovirus may yield better vaccines,https://scx2.b-cdn.net/gfx/news/hires/2025/canine-parvovirus-find.jpg,2025-02-18 07:18:23+00:00,"This article has been reviewed according to Science X's editorial process and policies . Editors have highlighted the following attributes while ensuring the content's credibility:

CryoEM structures ...",science,Caitlin Hayes,Unknown,Unknown
"Restoring African grassland habitats makes life more peaceful for humans and wildlife, scientists find",https://scx2.b-cdn.net/gfx/news/hires/2023/giraffes.jpg,2025-02-18 05:00:03+00:00,"This article has been reviewed according to Science X's editorial process and policies . Editors have highlighted the following attributes while ensuring the content's credibility:

Credit: Pixabay/CC...",science,phys,Yes,Real
Steven Weinberg: A Scientific Life,https://static.arxiv.org/icons/twitter/arxiv-logo-twitter-square.png,2025-02-18 05:00:00+00:00,"Steven Weinberg was a giant of late 20th Century physics on whose shoulders we stand while groping for the science of the 21st Century. This article provides a too-brief summary of a selection of his many achievements -- eight decades of superlative research, eight classic textbooks, eight best-sell...","academic, ASTRO","Quevedo, F.",No,Real
Scientific literature cited in patents: A Technology Transfer indicator in Portuguese universities,https://static.arxiv.org/icons/twitter/arxiv-logo-twitter-square.png,2025-02-18 05:00:00+00:00,"The study aims to identify the process of transfer from science to technology that occurs in the main Portuguese public universities. The methodology was based on the analysis of the scientific literature cited in patents. Data was obtained from the Lens patent database. 10,514 scientific articles c...","academic, CS","Galvez, Carmen",No,Real
Deep neural networks from the perspective of ergodic theory,https://static.arxiv.org/icons/twitter/arxiv-logo-twitter-square.png,2025-02-18 05:00:00+00:00,"The design of deep neural networks remains somewhat of an art rather than precise science. By tentatively adopting ergodic theory considerations on top of viewing the network as the time evolution of a dynamical system, with each layer corresponding to a temporal instance, we show that some rules of...","academic, CS","Zhang, Fan",Unknown,Unknown
Identifying Gender Stereotypes and Biases in Automated Translation from English to Italian using Similarity Networks,https://static.arxiv.org/icons/twitter/arxiv-logo-twitter-square.png,2025-02-18 05:00:00+00:00,"This paper is a collaborative effort between Linguistics, Law, and Computer Science to evaluate stereotypes and biases in automated translation systems. We advocate gender-neutral translation as a means to promote gender inclusion and improve the objectivity of machine translation. Our approach focu...","academic, CS","Maghool, Samira",Unknown,Unknown
An Iowa college gets a $10 million gift from the estate trust of a famous alum,https://media.zenfs.com/en/the-des-moines-register/90a4aa70609ef1ef96c2e0278bb1b061,2025-02-17 22:02:16+00:00,"Among other things, a $10 million gift from a tech icon alumni will allow an Iowa school to establish an endowed computer science chair",general,Des Moines Register,Unknown,Unknown
"Drug inspectors, AI experts, maternal health workers: Trump’s health agency cuts are far-reaching",https://www.statnews.com/wp-content/uploads/2025/02/GettyImages-2199640747-1024x576.jpg,2025-02-17 20:52:04+00:00,"In interview after interview with STAT, those who were fired from federal health and science agencies, along with officials who remain, argued the cuts would be deeply felt.",medical,Helen Branswell,Yes,Real
"At premier science gathering, ‘anger, uncertainty, and anxiety’ about the future of research under Trump",https://www.statnews.com/wp-content/uploads/2025/02/s3___bgmp-arc_arc-feeds_generic-photos_to-arc_tlumackiscience-1024x576.jpg,2025-02-17 20:41:31+00:00,"At the AAAS annual meeting, ""anger, uncertainty, and anxiety"" about the future of science under Trump.",biology,Anil Oza,Yes,Real
Leafbot: A soft robot that conquers challenging terrains,https://scx2.b-cdn.net/gfx/news/2025/leafbot-a-soft-robot-c.jpg,2025-02-17 20:19:24+00:00,"This article has been reviewed according to Science X's editorial process and policies . Editors have highlighted the following attributes while ensuring the content's credibility:

Leafbot’s adaptabi...",science,Japan Advanced Institute Of Science,Yes,Real
